{
 "schema_version": 1,
 "layer": "country-name vocabulary for the pre-retrieval intent gate (KG01)",
 "generated_at": "2026-10-22T03:29:17+00:00",
 "generator": {
  "script": "scripts/build_country_vocabulary.py",
  "pycountry": "26.2.16"
 },
 "source": {
  "name": "ISO 3166-1",
  "version": "26.2.16",
  "why": "a country rule needs a list that is committed and reproducible; the donor panel's membership is separate, in registry/donors/<vintage>/panel.json"
 },
 "excluded_from_refusal": [
  {
   "iso3": "NGA",
   "name": "Nigeria",
   "why": "every question in this project is about Nigeria; refusing the subject would refuse the corpus"
  }
 ],
 "counts": {
  "countries": 249
 },
 "countries": [
  {
   "iso3": "ABW",
   "iso2": "AW",
   "name": "Aruba",
   "aliases": [
    "Aruba"
   ]
  },
  {
   "iso3": "AFG",
   "iso2": "AF",
   "name": "Afghanistan",
   "aliases": [
    "Afghanistan"
   ]
  },
  {
   "iso3": "AGO",
   "iso2": "AO",
   "name": "Angola",
   "aliases": [
    "Angola"
   ]
  },
  {
   "iso3": "AIA",
   "iso2": "AI",
   "name": "Anguilla",
   "aliases": [
    "Anguilla"
   ]
  },
  {
   "iso3": "ALA",
   "iso2": "AX",
   "name": "Åland Islands",
   "aliases": [
    "Åland Islands"
   ]
  },
  {
   "iso3": "ALB",
   "iso2": "AL",
   "name": "Albania",
   "aliases": [
    "Albania"
   ]
  },
  {
   "iso3": "AND",
   "iso2": "AD",
   "name": "Andorra",
   "aliases": [
    "Andorra"
   ]
  },
  {
   "iso3": "ARE",
   "iso2": "AE",
   "name": "United Arab Emirates",
   "aliases": [
    "UAE",
    "United Arab Emirates"
   ]
  },
  {
   "iso3": "ARG",
   "iso2": "AR",
   "name": "Argentina",
   "aliases": [
    "Argentina"
   ]
  },
  {
   "iso3": "ARM",
   "iso2": "AM",
   "name": "Armenia",
   "aliases": [
    "Armenia"
   ]
  },
  {
   "iso3": "ASM",
   "iso2": "AS",
   "name": "American Samoa",
   "aliases": [
    "American Samoa"
   ]
  },
  {
   "iso3": "ATA",
   "iso2": "AQ",
   "name": "Antarctica",
   "aliases": [
    "Antarctica"
   ]
  },
  {
   "iso3": "ATF",
   "iso2": "TF",
   "name": "French Southern Territories",
   "aliases": [
    "French Southern Territories"
   ]
  },
  {
   "iso3": "ATG",
   "iso2": "AG",
   "name": "Antigua and Barbuda",
   "aliases": [
    "Antigua and Barbuda"
   ]
  },
  {
   "iso3": "AUS",
   "iso2": "AU",
   "name": "Australia",
   "aliases": [
    "Australia"
   ]
  },
  {
   "iso3": "AUT",
   "iso2": "AT",
   "name": "Austria",
   "aliases": [
    "Austria"
   ]
  },
  {
   "iso3": "AZE",
   "iso2": "AZ",
   "name": "Azerbaijan",
   "aliases": [
    "Azerbaijan"
   ]
  },
  {
   "iso3": "BDI",
   "iso2": "BI",
   "name": "Burundi",
   "aliases": [
    "Burundi"
   ]
  },
  {
   "iso3": "BEL",
   "iso2": "BE",
   "name": "Belgium",
   "aliases": [
    "Belgium"
   ]
  },
  {
   "iso3": "BEN",
   "iso2": "BJ",
   "name": "Benin",
   "aliases": [
    "Benin"
   ]
  },
  {
   "iso3": "BES",
   "iso2": "BQ",
   "name": "Bonaire, Sint Eustatius and Saba",
   "aliases": [
    "Bonaire, Sint Eustatius and Saba"
   ]
  },
  {
   "iso3": "BFA",
   "iso2": "BF",
   "name": "Burkina Faso",
   "aliases": [
    "Burkina Faso"
   ]
  },
  {
   "iso3": "BGD",
   "iso2": "BD",
   "name": "Bangladesh",
   "aliases": [
    "Bangladesh"
   ]
  },
  {
   "iso3": "BGR",
   "iso2": "BG",
   "name": "Bulgaria",
   "aliases": [
    "Bulgaria"
   ]
  },
  {
   "iso3": "BHR",
   "iso2": "BH",
   "name": "Bahrain",
   "aliases": [
    "Bahrain"
   ]
  },
  {
   "iso3": "BHS",
   "iso2": "BS",
   "name": "Bahamas",
   "aliases": [
    "Bahamas"
   ]
  },
  {
   "iso3": "BIH",
   "iso2": "BA",
   "name": "Bosnia and Herzegovina",
   "aliases": [
    "Bosnia",
    "Bosnia and Herzegovina"
   ]
  },
  {
   "iso3": "BLM",
   "iso2": "BL",
   "name": "Saint Barthélemy",
   "aliases": [
    "Saint Barthélemy"
   ]
  },
  {
   "iso3": "BLR",
   "iso2": "BY",
   "name": "Belarus",
   "aliases": [
    "Belarus"
   ]
  },
  {
   "iso3": "BLZ",
   "iso2": "BZ",
   "name": "Belize",
   "aliases": [
    "Belize"
   ]
  },
  {
   "iso3": "BMU",
   "iso2": "BM",
   "name": "Bermuda",
   "aliases": [
    "Bermuda"
   ]
  },
  {
   "iso3": "BOL",
   "iso2": "BO",
   "name": "Bolivia, Plurinational State of",
   "aliases": [
    "Bolivia",
    "Bolivia, Plurinational State of"
   ]
  },
  {
   "iso3": "BRA",
   "iso2": "BR",
   "name": "Brazil",
   "aliases": [
    "Brazil"
   ]
  },
  {
   "iso3": "BRB",
   "iso2": "BB",
   "name": "Barbados",
   "aliases": [
    "Barbados"
   ]
  },
  {
   "iso3": "BRN",
   "iso2": "BN",
   "name": "Brunei Darussalam",
   "aliases": [
    "Brunei",
    "Brunei Darussalam"
   ]
  },
  {
   "iso3": "BTN",
   "iso2": "BT",
   "name": "Bhutan",
   "aliases": [
    "Bhutan"
   ]
  },
  {
   "iso3": "BVT",
   "iso2": "BV",
   "name": "Bouvet Island",
   "aliases": [
    "Bouvet Island"
   ]
  },
  {
   "iso3": "BWA",
   "iso2": "BW",
   "name": "Botswana",
   "aliases": [
    "Botswana"
   ]
  },
  {
   "iso3": "CAF",
   "iso2": "CF",
   "name": "Central African Republic",
   "aliases": [
    "Central African Republic"
   ]
  },
  {
   "iso3": "CAN",
   "iso2": "CA",
   "name": "Canada",
   "aliases": [
    "Canada"
   ]
  },
  {
   "iso3": "CCK",
   "iso2": "CC",
   "name": "Cocos (Keeling) Islands",
   "aliases": [
    "Cocos (Keeling) Islands"
   ]
  },
  {
   "iso3": "CHE",
   "iso2": "CH",
   "name": "Switzerland",
   "aliases": [
    "Switzerland"
   ]
  },
  {
   "iso3": "CHL",
   "iso2": "CL",
   "name": "Chile",
   "aliases": [
    "Chile"
   ]
  },
  {
   "iso3": "CHN",
   "iso2": "CN",
   "name": "China",
   "aliases": [
    "China"
   ]
  },
  {
   "iso3": "CIV",
   "iso2": "CI",
   "name": "Côte d'Ivoire",
   "aliases": [
    "Cote d'Ivoire",
    "Côte d'Ivoire",
    "Ivory Coast"
   ]
  },
  {
   "iso3": "CMR",
   "iso2": "CM",
   "name": "Cameroon",
   "aliases": [
    "Cameroon"
   ]
  },
  {
   "iso3": "COD",
   "iso2": "CD",
   "name": "Congo, The Democratic Republic of the",
   "aliases": [
    "Congo",
    "Congo, The Democratic Republic of the",
    "DR Congo",
    "DRC",
    "Democratic Republic of the Congo"
   ]
  },
  {
   "iso3": "COG",
   "iso2": "CG",
   "name": "Congo",
   "aliases": [
    "Congo",
    "Republic of the Congo"
   ]
  },
  {
   "iso3": "COK",
   "iso2": "CK",
   "name": "Cook Islands",
   "aliases": [
    "Cook Islands"
   ]
  },
  {
   "iso3": "COL",
   "iso2": "CO",
   "name": "Colombia",
   "aliases": [
    "Colombia"
   ]
  },
  {
   "iso3": "COM",
   "iso2": "KM",
   "name": "Comoros",
   "aliases": [
    "Comoros"
   ]
  },
  {
   "iso3": "CPV",
   "iso2": "CV",
   "name": "Cabo Verde",
   "aliases": [
    "Cabo Verde"
   ]
  },
  {
   "iso3": "CRI",
   "iso2": "CR",
   "name": "Costa Rica",
   "aliases": [
    "Costa Rica"
   ]
  },
  {
   "iso3": "CUB",
   "iso2": "CU",
   "name": "Cuba",
   "aliases": [
    "Cuba"
   ]
  },
  {
   "iso3": "CUW",
   "iso2": "CW",
   "name": "Curaçao",
   "aliases": [
    "Curaçao"
   ]
  },
  {
   "iso3": "CXR",
   "iso2": "CX",
   "name": "Christmas Island",
   "aliases": [
    "Christmas Island"
   ]
  },
  {
   "iso3": "CYM",
   "iso2": "KY",
   "name": "Cayman Islands",
   "aliases": [
    "Cayman Islands"
   ]
  },
  {
   "iso3": "CYP",
   "iso2": "CY",
   "name": "Cyprus",
   "aliases": [
    "Cyprus"
   ]
  },
  {
   "iso3": "CZE",
   "iso2": "CZ",
   "name": "Czechia",
   "aliases": [
    "Czech Republic",
    "Czechia"
   ]
  },
  {
   "iso3": "DEU",
   "iso2": "DE",
   "name": "Germany",
   "aliases": [
    "Germany"
   ]
  },
  {
   "iso3": "DJI",
   "iso2": "DJ",
   "name": "Djibouti",
   "aliases": [
    "Djibouti"
   ]
  },
  {
   "iso3": "DMA",
   "iso2": "DM",
   "name": "Dominica",
   "aliases": [
    "Dominica"
   ]
  },
  {
   "iso3": "DNK",
   "iso2": "DK",
   "name": "Denmark",
   "aliases": [
    "Denmark"
   ]
  },
  {
   "iso3": "DOM",
   "iso2": "DO",
   "name": "Dominican Republic",
   "aliases": [
    "Dominican Republic"
   ]
  },
  {
   "iso3": "DZA",
   "iso2": "DZ",
   "name": "Algeria",
   "aliases": [
    "Algeria"
   ]
  },
  {
   "iso3": "ECU",
   "iso2": "EC",
   "name": "Ecuador",
   "aliases": [
    "Ecuador"
   ]
  },
  {
   "iso3": "EGY",
   "iso2": "EG",
   "name": "Egypt",
   "aliases": [
    "Egypt"
   ]
  },
  {
   "iso3": "ERI",
   "iso2": "ER",
   "name": "Eritrea",
   "aliases": [
    "Eritrea"
   ]
  },
  {
   "iso3": "ESH",
   "iso2": "EH",
   "name": "Western Sahara",
   "aliases": [
    "Western Sahara"
   ]
  },
  {
   "iso3": "ESP",
   "iso2": "ES",
   "name": "Spain",
   "aliases": [
    "Spain"
   ]
  },
  {
   "iso3": "EST",
   "iso2": "EE",
   "name": "Estonia",
   "aliases": [
    "Estonia"
   ]
  },
  {
   "iso3": "ETH",
   "iso2": "ET",
   "name": "Ethiopia",
   "aliases": [
    "Ethiopia"
   ]
  },
  {
   "iso3": "FIN",
   "iso2": "FI",
   "name": "Finland",
   "aliases": [
    "Finland"
   ]
  },
  {
   "iso3": "FJI",
   "iso2": "FJ",
   "name": "Fiji",
   "aliases": [
    "Fiji"
   ]
  },
  {
   "iso3": "FLK",
   "iso2": "FK",
   "name": "Falkland Islands (Malvinas)",
   "aliases": [
    "Falkland Islands (Malvinas)"
   ]
  },
  {
   "iso3": "FRA",
   "iso2": "FR",
   "name": "France",
   "aliases": [
    "France"
   ]
  },
  {
   "iso3": "FRO",
   "iso2": "FO",
   "name": "Faroe Islands",
   "aliases": [
    "Faroe Islands"
   ]
  },
  {
   "iso3": "FSM",
   "iso2": "FM",
   "name": "Micronesia, Federated States of",
   "aliases": [
    "Micronesia, Federated States of"
   ]
  },
  {
   "iso3": "GAB",
   "iso2": "GA",
   "name": "Gabon",
   "aliases": [
    "Gabon"
   ]
  },
  {
   "iso3": "GBR",
   "iso2": "GB",
   "name": "United Kingdom",
   "aliases": [
    "United Kingdom"
   ]
  },
  {
   "iso3": "GEO",
   "iso2": "GE",
   "name": "Georgia",
   "aliases": [
    "Georgia"
   ]
  },
  {
   "iso3": "GGY",
   "iso2": "GG",
   "name": "Guernsey",
   "aliases": [
    "Guernsey"
   ]
  },
  {
   "iso3": "GHA",
   "iso2": "GH",
   "name": "Ghana",
   "aliases": [
    "Ghana"
   ]
  },
  {
   "iso3": "GIB",
   "iso2": "GI",